Estrato,Nombre,Descripción,Nivel de Ingreso Promedio (COP),Acceso a Servicios Públicos,Tipo de Vivienda Común,Contribución o Subsidio,Ejemplo de Ciudades con este Estrato
1,Bajo-Bajo,"Zonas con infraestructura precaria, viviendas de materiales no duraderos, alto nivel de pobreza.",Menos de 1 SMMLV,"Limitado, con interrupciones frecuentes.",Casas improvisadas o en asentamientos informales.,Recibe alto subsidio en servicios públicos.,"Barrios periféricos en ciudades como Bogotá (Ciudad Bolívar), Medellín (Comuna 13), Cali (Aguablanca)."
2,Bajo,"Barrios con acceso parcial a servicios básicos, viviendas de calidad media-baja.",Entre 1 y 2 SMMLV,"Básico, con algunas limitaciones en calidad.",Casas de interés social o en barrios populares.,Recibe subsidios en servicios públicos.,Barrios populares en ciudades principales y municipios cercanos.
3,Medio-Bajo,"Sectores con acceso a servicios públicos, viviendas en buenas condiciones pero con limitaciones.",Entre 2 y 4 SMMLV,"Completo, aunque con posibilidad de fallos.",Casas y apartamentos de nivel medio.,No recibe subsidios ni contribuciones.,Sectores de clase media emergente en ciudades principales.
4,Medio,"Zonas urbanas con infraestructura completa, viviendas de tamaño medio.",Entre 4 y 10 SMMLV,"Óptimo, con buena calidad.",Casas y apartamentos en sectores tradicionales.,Tarifa estándar en servicios públicos.,Zonas urbanas con población de clase media establecida.
5,Medio-Alto,"Sectores con edificaciones modernas, acceso a servicios premium.",Entre 10 y 20 SMMLV,"Excelente, con disponibilidad garantizada.",Edificios modernos y condominios residenciales.,Contribuye al subsidio de los estratos bajos.,Barrios residenciales en sectores de alto desarrollo.
6,Alto,Zonas exclusivas con viviendas lujosas y acceso a múltiples comodidades.,Más de 20 SMMLV,"Premium, sin interrupciones.",Casas de lujo y apartamentos en sectores exclusivos.,Alta contribución al subsidio de estratos bajos.,Sectores exclusivos en ciudades capitales y zonas costeras de alto nivel.
